[
  {
    "id": "houlsby-2019",
    "title": "Parameter-Efficient Transfer Learning for NLP",
    "authors": [
      "Neil Houlsby",
      "Andrei Giurgiu",
      "Stanislaw Jastrzebski",
      "Bruna Morrone",
      "Quentin de Laroussilhe",
      "Andrea Gesmundo",
      "Mona Attariyan",
      "Sylvain Gelly"
    ],
    "venue": "ICML",
    "year": 2019,
    "arxiv": "1902.00751",
    "paper_url": "https://arxiv.org/abs/1902.00751",
    "code_url": "https://github.com/google-research/adapter-bert",
    "category": ["additive", "adapter-family"],
    "domain": ["nlp"],
    "backbone": ["BERT"],
    "key_idea": "Insert small bottleneck adapter modules between Transformer layers and train only them, keeping the pretrained backbone frozen.",
    "trainable_params_ratio": "~3.6%",
    "open_source": "official",
    "tags": ["foundational", "must-read"],
    "added_date": "2026-05-18"
  },
  {
    "id": "adapterfusion-2021",
    "title": "AdapterFusion: Non-Destructive Task Composition for Transfer Learning",
    "authors": [
      "Jonas Pfeiffer",
      "Aishwarya Kamath",
      "Andreas Rücklé",
      "Kyunghyun Cho",
      "Iryna Gurevych"
    ],
    "venue": "EACL",
    "year": 2021,
    "arxiv": "2005.00247",
    "paper_url": "https://arxiv.org/abs/2005.00247",
    "code_url": "https://github.com/adapter-hub/adapters",
    "category": ["additive", "adapter-family"],
    "domain": ["nlp"],
    "backbone": ["BERT", "RoBERTa"],
    "key_idea": "Two-stage scheme that first trains task-specific adapters, then composes them through an attention-based fusion layer.",
    "trainable_params_ratio": "varies",
    "open_source": "official",
    "tags": ["foundational"],
    "added_date": "2026-05-18"
  },
  {
    "id": "prefix-tuning-2021",
    "title": "Prefix-Tuning: Optimizing Continuous Prompts for Generation",
    "authors": [
      "Xiang Lisa Li",
      "Percy Liang"
    ],
    "venue": "ACL",
    "year": 2021,
    "arxiv": "2101.00190",
    "paper_url": "https://arxiv.org/abs/2101.00190",
    "code_url": "https://github.com/XiangLi1999/PrefixTuning",
    "category": ["additive", "soft-prompt"],
    "domain": ["nlp"],
    "backbone": ["GPT-2", "BART"],
    "key_idea": "Prepend trainable continuous prefix vectors to every Transformer layer while keeping the language model frozen.",
    "trainable_params_ratio": "0.1%",
    "open_source": "official",
    "tags": ["foundational", "must-read"],
    "added_date": "2026-05-18"
  },
  {
    "id": "prompt-tuning-2021",
    "title": "The Power of Scale for Parameter-Efficient Prompt Tuning",
    "authors": [
      "Brian Lester",
      "Rami Al-Rfou",
      "Noah Constant"
    ],
    "venue": "EMNLP",
    "year": 2021,
    "arxiv": "2104.08691",
    "paper_url": "https://arxiv.org/abs/2104.08691",
    "code_url": "https://github.com/google-research/prompt-tuning",
    "category": ["additive", "soft-prompt"],
    "domain": ["nlp"],
    "backbone": ["T5"],
    "key_idea": "Learn a small soft prompt prepended to the input; matches full fine-tuning once model scale is sufficiently large.",
    "trainable_params_ratio": "<0.01%",
    "open_source": "official",
    "tags": ["foundational", "must-read"],
    "added_date": "2026-05-18"
  },
  {
    "id": "p-tuning-v2-2022",
    "title": "P-Tuning v2: Prompt Tuning Can Be Comparable to Fine-tuning Universally Across Scales and Tasks",
    "authors": [
      "Xiao Liu",
      "Kaixuan Ji",
      "Yicheng Fu",
      "Weng Lam Tam",
      "Zhengxiao Du",
      "Zhilin Yang",
      "Jie Tang"
    ],
    "venue": "ACL",
    "year": 2022,
    "arxiv": "2110.07602",
    "paper_url": "https://arxiv.org/abs/2110.07602",
    "code_url": "https://github.com/THUDM/P-tuning-v2",
    "category": ["additive", "soft-prompt"],
    "domain": ["nlp"],
    "backbone": ["BERT", "RoBERTa", "GLM"],
    "key_idea": "Apply deep prompt tuning at every layer so prompt tuning stays competitive across model scales and sequence labelling tasks.",
    "trainable_params_ratio": "0.1%-3%",
    "open_source": "official",
    "tags": ["foundational"],
    "added_date": "2026-05-18"
  },
  {
    "id": "lora-2022",
    "title": "LoRA: Low-Rank Adaptation of Large Language Models",
    "authors": [
      "Edward J. Hu",
      "Yelong Shen",
      "Phillip Wallis",
      "Zeyuan Allen-Zhu",
      "Yuanzhi Li",
      "Shean Wang",
      "Lu Wang",
      "Weizhu Chen"
    ],
    "venue": "ICLR",
    "year": 2022,
    "arxiv": "2106.09685",
    "paper_url": "https://arxiv.org/abs/2106.09685",
    "code_url": "https://github.com/microsoft/LoRA",
    "category": ["reparameterization", "lora-family"],
    "domain": ["nlp"],
    "backbone": ["GPT-3", "RoBERTa", "DeBERTa"],
    "key_idea": "Inject trainable low-rank decomposition matrices into frozen weight matrices to approximate full fine-tuning updates.",
    "trainable_params_ratio": "0.01%-0.1%",
    "open_source": "official",
    "tags": ["foundational", "must-read"],
    "added_date": "2026-05-18"
  },
  {
    "id": "bitfit-2022",
    "title": "BitFit: Simple Parameter-efficient Fine-tuning for Transformer-based Masked Language-models",
    "authors": [
      "Elad Ben Zaken",
      "Shauli Ravfogel",
      "Yoav Goldberg"
    ],
    "venue": "ACL",
    "year": 2022,
    "arxiv": "2106.10199",
    "paper_url": "https://arxiv.org/abs/2106.10199",
    "code_url": "https://github.com/benzakenelad/BitFit",
    "category": ["selective"],
    "domain": ["nlp"],
    "backbone": ["BERT"],
    "key_idea": "Fine-tune only the bias terms of a pretrained Transformer, matching full fine-tuning on small-to-medium tasks.",
    "trainable_params_ratio": "0.08%-0.1%",
    "open_source": "official",
    "tags": ["foundational"],
    "added_date": "2026-05-18"
  },
  {
    "id": "unified-peft-2022",
    "title": "Towards a Unified View of Parameter-Efficient Transfer Learning",
    "authors": [
      "Junxian He",
      "Chunting Zhou",
      "Xuezhe Ma",
      "Taylor Berg-Kirkpatrick",
      "Graham Neubig"
    ],
    "venue": "ICLR",
    "year": 2022,
    "arxiv": "2110.04366",
    "paper_url": "https://arxiv.org/abs/2110.04366",
    "code_url": "https://github.com/jxhe/unify-parameter-efficient-tuning",
    "category": ["hybrid"],
    "domain": ["nlp"],
    "backbone": ["BART", "RoBERTa"],
    "key_idea": "Cast adapters, prefix tuning, and LoRA as instances of one design space, yielding the MAM Adapter hybrid.",
    "trainable_params_ratio": "varies",
    "open_source": "official",
    "tags": ["foundational", "must-read", "survey"],
    "added_date": "2026-05-18"
  },
  {
    "id": "compacter-2021",
    "title": "Compacter: Efficient Low-Rank Hypercomplex Adapter Layers",
    "authors": [
      "Rabeeh Karimi Mahabadi",
      "James Henderson",
      "Sebastian Ruder"
    ],
    "venue": "NeurIPS",
    "year": 2021,
    "arxiv": "2106.04647",
    "paper_url": "https://arxiv.org/abs/2106.04647",
    "code_url": "https://github.com/rabeehk/compacter",
    "category": ["additive", "adapter-family"],
    "domain": ["nlp"],
    "backbone": ["T5"],
    "key_idea": "Use Kronecker-product hypercomplex low-rank parameterization to shrink adapter parameters by orders of magnitude.",
    "trainable_params_ratio": "~0.05%",
    "open_source": "official",
    "tags": ["foundational"],
    "added_date": "2026-05-18"
  },
  {
    "id": "delta-tuning-2023",
    "title": "Parameter-efficient fine-tuning of large-scale pre-trained language models",
    "authors": [
      "Ning Ding",
      "Yujia Qin",
      "Guang Yang",
      "Fuchao Wei",
      "Zonghan Yang",
      "Yusheng Su",
      "Shengding Hu",
      "Yulin Chen",
      "Chi-Min Chan",
      "Weize Chen",
      "Jing Yi",
      "Weilin Zhao",
      "Xiaozhi Wang",
      "Zhiyuan Liu",
      "Hai-Tao Zheng",
      "Jianfei Chen",
      "Yang Liu",
      "Jie Tang",
      "Juanzi Li",
      "Maosong Sun"
    ],
    "venue": "Nature Machine Intelligence",
    "year": 2023,
    "arxiv": "2203.06904",
    "paper_url": "https://arxiv.org/abs/2203.06904",
    "code_url": "https://github.com/thunlp/OpenDelta",
    "category": ["other"],
    "domain": ["nlp"],
    "backbone": ["BERT", "T5", "GPT"],
    "key_idea": "Comprehensive empirical study and taxonomy of delta tuning methods, with theoretical analyses linking them to optimization and optimal control.",
    "trainable_params_ratio": "varies",
    "open_source": "official",
    "tags": ["survey", "must-read"],
    "added_date": "2026-05-18"
  },
  {
    "id": "qlora-2023",
    "title": "QLoRA: Efficient Finetuning of Quantized LLMs",
    "authors": [
      "Tim Dettmers",
      "Artidoro Pagnoni",
      "Ari Holtzman",
      "Luke Zettlemoyer"
    ],
    "venue": "NeurIPS",
    "year": 2023,
    "arxiv": "2305.14314",
    "paper_url": "https://arxiv.org/abs/2305.14314",
    "code_url": "https://github.com/artidoro/qlora",
    "category": ["reparameterization", "lora-family"],
    "domain": ["nlp"],
    "backbone": ["LLaMA", "OPT"],
    "key_idea": "Combine 4-bit NF4 quantization, double quantization, and paged optimizers with LoRA to fine-tune 65B models on a single GPU.",
    "trainable_params_ratio": "0.1%-0.5%",
    "open_source": "official",
    "tags": ["must-read"],
    "added_date": "2026-05-18"
  },
  {
    "id": "adalora-2023",
    "title": "AdaLoRA: Adaptive Budget Allocation for Parameter-Efficient Fine-Tuning",
    "authors": [
      "Qingru Zhang",
      "Minshuo Chen",
      "Alexander Bukharin",
      "Pengcheng He",
      "Yu Cheng",
      "Weizhu Chen",
      "Tuo Zhao"
    ],
    "venue": "ICLR",
    "year": 2023,
    "arxiv": "2303.10512",
    "paper_url": "https://arxiv.org/abs/2303.10512",
    "code_url": "https://github.com/QingruZhang/AdaLoRA",
    "category": ["reparameterization", "lora-family"],
    "domain": ["nlp"],
    "backbone": ["DeBERTa", "BART"],
    "key_idea": "Parameterize LoRA updates as SVD-style decompositions and adaptively prune unimportant singular values to allocate rank budgets per layer.",